Name,Slug,Collection ID,Locale ID,Item ID,Archived,Draft,Created On,Updated On,Published On,Main Image,Thumb Image,Gallery Images,Price,Area,Overview,Location,Sale,Is Leased?
(#112) First Floor Office,112-first-floor-office,66feff006098b94b602774a2,66feff006098b94b602774a1,6706c4cd8d7f19cfb6ce0e17,false,false,Wed Oct 09 2024 18:00:45 GMT+0000 (Coordinated Universal Time),Wed Oct 22 2025 19:58:39 GMT+0000 (Coordinated Universal Time),Thu Oct 23 2025 19:06:14 GMT+0000 (Coordinated Universal Time),https://cdn.prod.website-files.com/66feff006098b94b602774a0/6706c4a63cf0ee51768328e8_Office-112-2021-2-__FocusFillWzE2ODAsOTQ1LCJ5IiwxNThd.jpg,https://cdn.prod.website-files.com/66feff006098b94b602774a0/6706c4a63cf0ee51768328e8_Office-112-2021-2-__FocusFillWzE2ODAsOTQ1LCJ5IiwxNThd.jpg,https://cdn.prod.website-files.com/66feff006098b94b602774a0/68f9365345997c7d32cb888c_Office%20%23115%20Fall%201%20.jpg; https://cdn.prod.website-files.com/66feff006098b94b602774a0/68f9365497607e587fbcb8ad_Office%20112%202021%20Far%20Wall%204%20.jpg; https://cdn.prod.website-files.com/66feff006098b94b602774a0/68f9365375888693ac77efd7_Office%20%23115%203%20.jpg; https://cdn.prod.website-files.com/66feff006098b94b602774a0/68f9365304317b4d1e395c6c_Office%20%23115%202%20.jpg,$485,,"<p><strong id="""">UPDATE:</strong> This office has been recently leased, but check out <strong id="""">our other office space availabilities</strong>.</p>",,false,no
(#114) First Floor Office,114-first-floor-office,66feff006098b94b602774a2,66feff006098b94b602774a1,6706c3b7d26cd06b5eedea21,false,true,Wed Oct 09 2024 17:56:07 GMT+0000 (Coordinated Universal Time),Mon Aug 11 2025 15:12:41 GMT+0000 (Coordinated Universal Time),,https://cdn.prod.website-files.com/66feff006098b94b602774a0/6706c3815cc6bada54a5d1c2_114-Mirror-__FocusFillWzE2ODAsOTQ1LCJ5IiwxNThd.jpg,https://cdn.prod.website-files.com/66feff006098b94b602774a0/6706c3815cc6bada54a5d1c2_114-Mirror-__FocusFillWzE2ODAsOTQ1LCJ5IiwxNThd.jpg,https://cdn.prod.website-files.com/66feff006098b94b602774a0/6706c3815cc6bada54a5d1c2_114-Mirror-__FocusFillWzE2ODAsOTQ1LCJ5IiwxNThd.jpg; https://cdn.prod.website-files.com/66feff006098b94b602774a0/6706c388c7a9bbbca1b4e617_114-new-__FitMaxWzIwMDAsMjAwMF0.jpg; https://cdn.prod.website-files.com/66feff006098b94b602774a0/6706c3888fb47b5b6751425c_114-Shelves-__FitMaxWzIwMDAsMjAwMF0.jpg,LEASED,,"<p><strong id="""">UPDATE:</strong> This office has been recently leased, but check out <strong id="""">our other office space availabilities</strong>.</p>",,false,
(#115) First Floor Office,115-first-floor-office,66feff006098b94b602774a2,66feff006098b94b602774a1,6706c342357e351fcb00df17,false,false,Wed Oct 09 2024 17:54:10 GMT+0000 (Coordinated Universal Time),Wed Oct 22 2025 19:59:48 GMT+0000 (Coordinated Universal Time),Thu Oct 23 2025 19:06:14 GMT+0000 (Coordinated Universal Time),https://cdn.prod.website-files.com/66feff006098b94b602774a0/6706c313e863ab58e3b3a57b_115-2-2021__FocusFillWzE2ODAsOTQ1LCJ5IiwxNThd.jpg,https://cdn.prod.website-files.com/66feff006098b94b602774a0/6706c313e863ab58e3b3a57b_115-2-2021__FocusFillWzE2ODAsOTQ1LCJ5IiwxNThd.jpg,https://cdn.prod.website-files.com/66feff006098b94b602774a0/6706c313e863ab58e3b3a57b_115-2-2021__FocusFillWzE2ODAsOTQ1LCJ5IiwxNThd.jpg; https://cdn.prod.website-files.com/66feff006098b94b602774a0/6706c31a3384b9a1c88ffe57_115-3-2021-__FitMaxWzIwMDAsMjAwMF0.jpg; https://cdn.prod.website-files.com/66feff006098b94b602774a0/6706c31aeec464d7389b9be6_115-Window-__FitMaxWzIwMDAsMjAwMF0.jpg,LEASED,,"<p id="""">Our current customer has grown again, and must re-position, making this beautiful space available! Central HVAC, window to the front, new LEDs, and suitable for 1 to 3 work stations.</p><p id="""">‍</p>",,false,yes
(#132) First Floor Office,132-first-floor-office,66feff006098b94b602774a2,66feff006098b94b602774a1,6706c60330684b82caa8d256,false,true,Wed Oct 09 2024 18:05:55 GMT+0000 (Coordinated Universal Time),Mon Aug 11 2025 15:13:08 GMT+0000 (Coordinated Universal Time),,https://cdn.prod.website-files.com/66feff006098b94b602774a0/6706c5dfcee86a8f3613ebba_Steven-2023-1__FocusFillWzE2ODAsOTQ1LCJ5IiwxNTdd.jpg,https://cdn.prod.website-files.com/66feff006098b94b602774a0/6706c5dfcee86a8f3613ebba_Steven-2023-1__FocusFillWzE2ODAsOTQ1LCJ5IiwxNTdd.jpg,https://cdn.prod.website-files.com/66feff006098b94b602774a0/6706c5e67861a8a7f4524950_Office-32-4-2022__FitMaxWzIwMDAsMjAwMF0.jpg; https://cdn.prod.website-files.com/66feff006098b94b602774a0/6706c5e606d779aafb323dff_Office-32-5-2022-v2__FitMaxWzIwMDAsMjAwMF0.jpg; https://cdn.prod.website-files.com/66feff006098b94b602774a0/6706c5e6e428829c2c31b0a0_Steven-2023-1__FitMaxWzIwMDAsMjAwMF0.jpg; https://cdn.prod.website-files.com/66feff006098b94b602774a0/6706c5dfcee86a8f3613ebba_Steven-2023-1__FocusFillWzE2ODAsOTQ1LCJ5IiwxNTdd.jpg; https://cdn.prod.website-files.com/66feff006098b94b602774a0/6706c5e66579df1cabfa83dc_Steven-2023-2__FitMaxWzIwMDAsMjAwMF0.jpg,LEASED,,"<p>There are only a few offices that offer this size and they do not stay available long! The first pics are of the office and others to show Reception, the two Conference Rooms and just a few of our favorite Drivers! There are also <em id="""">terrific outdoor areas</em> and a nearly completed 1/4 mile on-site, private walking path. Many Customers make use of these areas as ""Outdoor Conference Rooms"". There are tables and, seasonally, umbrellas in the yard areas too!</p>",,false,
(#132) Shop/Studio,132-shop-studio,66feff006098b94b602774a2,66feff006098b94b602774a1,66feff006098b94b602774e9,false,true,Fri Jul 19 2024 05:38:37 GMT+0000 (Coordinated Universal Time),Mon Aug 11 2025 15:10:34 GMT+0000 (Coordinated Universal Time),,https://cdn.prod.website-files.com/66feff006098b94b602774a0/6706a7315ac40d1ff4d252b2_132-Hall-to-Garage-Area-Rug-June-19-2024__FocusFillWzE2ODAsOTQ1LCJ5IiwzNV0.jpg,https://cdn.prod.website-files.com/66feff006098b94b602774a0/6706a7315ac40d1ff4d252b2_132-Hall-to-Garage-Area-Rug-June-19-2024__FocusFillWzE2ODAsOTQ1LCJ5IiwzNV0.jpg,https://cdn.prod.website-files.com/66feff006098b94b602774a0/6706a7315ac40d1ff4d252b2_132-Hall-to-Garage-Area-Rug-June-19-2024__FocusFillWzE2ODAsOTQ1LCJ5IiwzNV0.jpg; https://cdn.prod.website-files.com/66feff006098b94b602774a0/6706a86ac4b476be3266003e_2022-Step-Away-1-__FocusFillWzY0MCw2NDAsIngiLDEwN10.jpg; https://cdn.prod.website-files.com/66feff006098b94b602774a0/6706a86adf050e05187c5062_2022-Step-Away-2-__FocusFillWzY0MCw2NDAsIngiLDEwNl0.jpg,$875/mo,750sq ft,"<p id="""">True flex space with great features and amenities AND the right size! Includes signature, full front desk support and full-time, experienced, on-site management team!</p>",,false,
(#133) First Floor Office,133-first-floor-office,66feff006098b94b602774a2,66feff006098b94b602774a1,6706c2d29d85d9f9b4e1c51b,false,true,Wed Oct 09 2024 17:52:18 GMT+0000 (Coordinated Universal Time),Mon Aug 11 2025 15:12:24 GMT+0000 (Coordinated Universal Time),,https://cdn.prod.website-files.com/66feff006098b94b602774a0/6706c2a4fb2eb1995e607596_July-2020-33-3-__FocusFillWzE2ODAsOTQ1LCJ5IiwxNThd.jpg,https://cdn.prod.website-files.com/66feff006098b94b602774a0/6706c2a4fb2eb1995e607596_July-2020-33-3-__FocusFillWzE2ODAsOTQ1LCJ5IiwxNThd.jpg,https://cdn.prod.website-files.com/66feff006098b94b602774a0/6706c2ace170d17f8436c762_Front-Office-2-2022__FitMaxWzIwMDAsMjAwMF0.jpg; https://cdn.prod.website-files.com/66feff006098b94b602774a0/6706c2a4fb2eb1995e607596_July-2020-33-3-__FocusFillWzE2ODAsOTQ1LCJ5IiwxNThd.jpg,$550/mo,20 sq ft,"<p><strong id="""">First Floor Office with LARGE window!</strong> Suits One to Two Standard Work Stations. *Convenient! To everything! *Kitchenettes - Pod Coffee Brewers, Fridge/Freezers, Toaster Ovens, Microwaves and Stainless Sinks</p>",,false,no
(#134 & #135) Better Than a Side-By-Side,134-135-better-than-a-side-by-side,66feff006098b94b602774a2,66feff006098b94b602774a1,6706c74c47b8536a9a7dcd0f,false,true,Wed Oct 09 2024 18:11:24 GMT+0000 (Coordinated Universal Time),Mon Aug 11 2025 15:13:29 GMT+0000 (Coordinated Universal Time),,https://cdn.prod.website-files.com/66feff006098b94b602774a0/6706c71c11c25dae3298b577_Office-35-to-34-long-4-__FocusFillWzE2ODAsOTQ1LCJ5IiwyMjVd.jpg,https://cdn.prod.website-files.com/66feff006098b94b602774a0/6706c71c11c25dae3298b577_Office-35-to-34-long-4-__FocusFillWzE2ODAsOTQ1LCJ5IiwyMjVd.jpg,https://cdn.prod.website-files.com/66feff006098b94b602774a0/6706c7240a2519355fc40719_Office-34-35-Window-to-35-__FitMaxWzIwMDAsMjAwMF0.jpg; https://cdn.prod.website-files.com/66feff006098b94b602774a0/6706c7237f1fed5366b5120e_Office-34-Rear-Wall-Close-6-__FitMaxWzIwMDAsMjAwMF0.jpg; https://cdn.prod.website-files.com/66feff006098b94b602774a0/6706c7241ea1ad9f444061da_Office-35-to-34-long-4-__FitMaxWzIwMDAsMjAwMF0.jpg; https://cdn.prod.website-files.com/66feff006098b94b602774a0/6706c71c11c25dae3298b577_Office-35-to-34-long-4-__FocusFillWzE2ODAsOTQ1LCJ5IiwyMjVd.jpg; https://cdn.prod.website-files.com/66feff006098b94b602774a0/6706c724c0507748ee3eda14_Office-35-to-43-Window-Desk-8-__FitMaxWzIwMDAsMjAwMF0.jpg,LEASED,,"<p id=""""><strong id="""">First Floor Office</strong> – This set-up is not a traditional side-by-side – it is better! Historically, the smaller office of the two is “set” as owner/manager use and the larger is fashioned for staff/sales associate and/or team meeting space or desk space. In the first five images, see the scope of “Open Concept” as regards connectivity of your support staff, while easily maintaining privacy as required. Suits one to six - standard work stations and/or inventory space.</p><p>‍</p><p id="""">Is HOW you are working, working for YOU?</p><p>‍</p><p id="""">Is your setting, operations and budget, your customers and staff, optimally connected to support your work?</p><p>‍</p><p id="""">For 35 years, the Lansdale Business Center has been successfully helping significant numbers of exciting businesses and interests on-site, and is poised to help yours today!</p><p>‍</p><p>‍</p><p id="""">In addition to your office, our two conference rooms, also pictured, offer myriad solutions for work that requires diverse settings for various tasks, presentations and sales activities – right here!</p><p>‍</p><p id="""">Convenient to everything! With award winning signature front desk services, Monday – Friday, to greet your clients, patients and prospects and customers recognize a huge value in sales, repeats and retention.</p><p>‍</p><p id="""">A solid long standing mailing address and reputation and when you are off site, we will receive your packages and other post that require signature, and alert you to them!</p><p>‍</p><p id="""">Visitors consistently share that they are impressed by the conference rooms, kitchenettes, private parking, fresh style, grounds and more!</p><p>‍</p>",,false,
(#137 A&B) Side-By-Side Offices,137-a-b-side-by-side-offices,66feff006098b94b602774a2,66feff006098b94b602774a1,6706c5966673d3bee076595d,false,true,Wed Oct 09 2024 18:04:06 GMT+0000 (Coordinated Universal Time),Fri Feb 14 2025 14:42:32 GMT+0000 (Coordinated Universal Time),,https://cdn.prod.website-files.com/66feff006098b94b602774a0/6706c52d6579df1cabf9c4c3_Side-by-7-2022__FocusFillWzE2ODAsOTQ1LCJ5IiwxNThd.jpg,https://cdn.prod.website-files.com/66feff006098b94b602774a0/6706c52d6579df1cabf9c4c3_Side-by-7-2022__FocusFillWzE2ODAsOTQ1LCJ5IiwxNThd.jpg,https://cdn.prod.website-files.com/66feff006098b94b602774a0/6706c5783186b50f5886b7ba_Side-by-4-2022-__FitMaxWzIwMDAsMjAwMF0.jpg; https://cdn.prod.website-files.com/66feff006098b94b602774a0/6706c5794b866b2ea83f234a_Side-by-5-2022__FitMaxWzIwMDAsMjAwMF0.jpg; https://cdn.prod.website-files.com/66feff006098b94b602774a0/6706c5781ea1ad9f443ee3f9_Side-by-6-2022__FitMaxWzIwMDAsMjAwMF0.jpg; https://cdn.prod.website-files.com/66feff006098b94b602774a0/6706c52d6579df1cabf9c4c3_Side-by-7-2022__FocusFillWzE2ODAsOTQ1LCJ5IiwxNThd.jpg; https://cdn.prod.website-files.com/66feff006098b94b602774a0/6706c5782e656a4273bcb357_Side-by-9-2022__FitMaxWzIwMDAsMjAwMF0.jpg; https://cdn.prod.website-files.com/66feff006098b94b602774a0/6706c578e1b52fb89e61d8a7_Side-by-10-2022-__FitMaxWzIwMDAsMjAwMF0.jpg; https://cdn.prod.website-files.com/66feff006098b94b602774a0/6706c578b102649ffd617bf3_Side-S-1-2022__FitMaxWzIwMDAsMjAwMF0.jpg; https://cdn.prod.website-files.com/66feff006098b94b602774a0/6706c5783186b50f5886b7a4_Side-S-2-2022__FitMaxWzIwMDAsMjAwMF0.jpg,LEASED,,"<p id="""">First Floor, <em id="""">Side by Side</em> Offices – Two most recent Customers have used one side for <strong id="""">Media/Conference Space</strong> and the other for <strong id="""">Client Management and Admin</strong>. At the moment, they are both shown as individual offices with a separately locking pass door – Up to you! </p><p>‍</p><p id="""">Larger footprint is (+-) 234sf and the other is (+-) 180sf</p><p>‍</p>",,false,
(#144) First Floor Office,144-first-floor-office,66feff006098b94b602774a2,66feff006098b94b602774a1,6706c678ce22784747759e37,false,true,Wed Oct 09 2024 18:07:52 GMT+0000 (Coordinated Universal Time),Mon Aug 11 2025 15:13:16 GMT+0000 (Coordinated Universal Time),,https://cdn.prod.website-files.com/66feff006098b94b602774a0/6706c65bcd1047007036ddf1_2-144-2-__FocusFillWzE2ODAsOTQ1LCJ5Iiw0OF0.jpg,https://cdn.prod.website-files.com/66feff006098b94b602774a0/6706c65bcd1047007036ddf1_2-144-2-__FocusFillWzE2ODAsOTQ1LCJ5Iiw0OF0.jpg,https://cdn.prod.website-files.com/66feff006098b94b602774a0/6706c662e4cd97e12cd9f37e_2-144-1-__FitMaxWzIwMDAsMjAwMF0.jpg; https://cdn.prod.website-files.com/66feff006098b94b602774a0/6706c6629930923f7ad2ddb9_2-144-2-__FitMaxWzIwMDAsMjAwMF0.jpg; https://cdn.prod.website-files.com/66feff006098b94b602774a0/6706c65bcd1047007036ddf1_2-144-2-__FocusFillWzE2ODAsOTQ1LCJ5Iiw0OF0.jpg; https://cdn.prod.website-files.com/66feff006098b94b602774a0/6706c662e2aa2bbc1fc8a86e_2-144-4-__FitMaxWzIwMDAsMjAwMF0.jpg; https://cdn.prod.website-files.com/66feff006098b94b602774a0/6706c662d61a73b94f820096_2-144-5-__FitMaxWzIwMDAsMjAwMF0.jpg; https://cdn.prod.website-files.com/66feff006098b94b602774a0/6706c663876e50762c3fd58c_2-144-7__FitMaxWzIwMDAsMjAwMF0.jpg,LEASED,,"<p>This space is pictured with <em id="""">two and four traditional workstations</em> and can remain this way, or have the furniture removed for yours… up to you! This space has a top of the line GE through the wall unit, so you control your own climate. Nice! And it features a large sliding style window for fresh air as you want it!</p>",,false,
(#147) First Floor Office,147-first-floor-office,66feff006098b94b602774a2,66feff006098b94b602774a1,6706c6dbc8c10752d97fcfc6,false,true,Wed Oct 09 2024 18:09:31 GMT+0000 (Coordinated Universal Time),Mon Aug 11 2025 15:13:23 GMT+0000 (Coordinated Universal Time),,https://cdn.prod.website-files.com/66feff006098b94b602774a0/6706c6ba01b9196b43486836_00303_bNqmVpmDDQ9_0sS0lE_1200x900__FocusFillWzE2ODAsOTQ1LCJ5IiwxNTdd.jpg,https://cdn.prod.website-files.com/66feff006098b94b602774a0/6706c6ba01b9196b43486836_00303_bNqmVpmDDQ9_0sS0lE_1200x900__FocusFillWzE2ODAsOTQ1LCJ5IiwxNTdd.jpg,https://cdn.prod.website-files.com/66feff006098b94b602774a0/6706c6bf820a7578a7d70285_00Q0Q_4DwjHzWGiMw_0vM0nP_1200x900__FitMaxWzIwMDAsMjAwMF0.jpg; https://cdn.prod.website-files.com/66feff006098b94b602774a0/6706c6ba01b9196b43486836_00303_bNqmVpmDDQ9_0sS0lE_1200x900__FocusFillWzE2ODAsOTQ1LCJ5IiwxNTdd.jpg; https://cdn.prod.website-files.com/66feff006098b94b602774a0/6706c6bf80845278b35916ec_00303_bNqmVpmDDQ9_0sS0lE_1200x900-2__FitMaxWzIwMDAsMjAwMF0.jpg; https://cdn.prod.website-files.com/66feff006098b94b602774a0/6706c6bf86b723edf6c7e5bc_00909_2Moe0fmgQNP_0tQ0mm_1200x900__FitMaxWzIwMDAsMjAwMF0.jpg,LEASED,,"<p id="""">This space is pictured with two traditional workstations and can remain this way, or have the furniture removed for yours… up to you! This space has a top of the line GE through the wall unit, so you control your own climate. Nice! And it features a large sliding style window for fresh air as you want it!</p><p>‍</p><p id="""">Convenient to Everything – Beautiful spaces and private parking, as well as access to important local services and agencies -</p><p>‍</p><p id="""">The first few pictures are of the actual office and the others show the ""Main Conference"" and ""Step Away"" rooms. No additional cost for these spaces and/or time in them. There are also photos of outdoor and ""common areas"" on site.</p><p>‍</p>",,false,
(#22 A&B) First Floor Open Concept,22-a-b-first-floor-open-concept,66feff006098b94b602774a2,66feff006098b94b602774a1,6706c82320be3bd3a68c1a6b,false,true,Wed Oct 09 2024 18:14:59 GMT+0000 (Coordinated Universal Time),Mon Aug 11 2025 15:13:34 GMT+0000 (Coordinated Universal Time),,https://cdn.prod.website-files.com/66feff006098b94b602774a0/6706c7edafe75226bb7fd4e4_CAN-3-2023-__FocusFillWzE2ODAsOTQ1LCJ5IiwyNTFd.jpg,https://cdn.prod.website-files.com/66feff006098b94b602774a0/6706c7edafe75226bb7fd4e4_CAN-3-2023-__FocusFillWzE2ODAsOTQ1LCJ5IiwyNTFd.jpg,https://cdn.prod.website-files.com/66feff006098b94b602774a0/6706c7f899240c3f3ce65b51_CAN-3-2023-__FitMaxWzIwMDAsMjAwMF0.jpg; https://cdn.prod.website-files.com/66feff006098b94b602774a0/6706c7edafe75226bb7fd4e4_CAN-3-2023-__FocusFillWzE2ODAsOTQ1LCJ5IiwyNTFd.jpg; https://cdn.prod.website-files.com/66feff006098b94b602774a0/6706c7f8d03993abac3bac58_CAN-4-2023-__FitMaxWzIwMDAsMjAwMF0.jpg; https://cdn.prod.website-files.com/66feff006098b94b602774a0/6706c7f8612cee3cc8356bd9_CAN-5-2023-__FitMaxWzIwMDAsMjAwMF0.jpg; https://cdn.prod.website-files.com/66feff006098b94b602774a0/6706c7f8556eb6d6485e9a20_CAN-8-2023-__FitMaxWzIwMDAsMjAwMF0.jpg; https://cdn.prod.website-files.com/66feff006098b94b602774a0/6706c7f8d8f00b7da4d38565_CAN-9-2023-Copy__FitMaxWzIwMDAsMjAwMF0.jpg; https://cdn.prod.website-files.com/66feff006098b94b602774a0/6706c7f89a63e96a97089a2d_CAN-10-2023-__FitMaxWzIwMDAsMjAwMF0.jpg; https://cdn.prod.website-files.com/66feff006098b94b602774a0/6706c7f8d03993abac3bac5b_CAN-END-2023-__FitMaxWzIwMDAsMjAwMF0.jpg; https://cdn.prod.website-files.com/66feff006098b94b602774a0/6706c7f8b04d2459f55448f6_General-Meeting-Space__FitMaxWzIwMDAsMjAwMF0.jpeg,LEASED,,"<p id="""">Join our Lansdale Business Center Community, comprised of dynamic and exciting individuals and businesses, focused on growing and enhancing their products, while sharing their passion for their work!</p><p>‍</p><p id="""">The only Season to consider is YOURS! So no worry about time to time promos and discounts here - Rents are guaranteed for at least 12 months and there are no ""matter of course"" Anniversary Date increases either!</p><p>‍</p><p id="""">Here - Let natural light coupled with a hip, Industrial Chic vibe Spark Productivity and Creativity! Skylights let the sun shine in and the space is “Open Concept” while easily adapting to more defined arrangements, great for Client Meetings, Design Teams and other Consultants.</p><p>‍</p>",,false,
(#223) Second Floor Office,223-second-floor-office,66feff006098b94b602774a2,66feff006098b94b602774a1,67af58cf37904a66d70dfbfe,false,true,Fri Feb 14 2025 14:53:03 GMT+0000 (Coordinated Universal Time),Wed Oct 22 2025 19:55:14 GMT+0000 (Coordinated Universal Time),,https://cdn.prod.website-files.com/66feff006098b94b602774a0/67af589e36e60e470a4f40a5_Office%202nd%20Floor%204%202024.jpg,https://cdn.prod.website-files.com/66feff006098b94b602774a0/67af589e36e60e470a4f40a5_Office%202nd%20Floor%204%202024.jpg,https://cdn.prod.website-files.com/66feff006098b94b602774a0/67af58a5f54bc0cdb2ab12ec_off%20window%201.jpg; https://cdn.prod.website-files.com/66feff006098b94b602774a0/67af58a455154a4f0334d543_off%20window%203.jpg; https://cdn.prod.website-files.com/66feff006098b94b602774a0/67af589e36e60e470a4f40a5_Office%202nd%20Floor%204%202024.jpg; https://cdn.prod.website-files.com/66feff006098b94b602774a0/67af58a31aa5c5fab7e0c18a_Office%202nd%20Floor%205%202024.jpg; https://cdn.prod.website-files.com/66feff006098b94b602774a0/67af58a3264a42cf766975d2_Office%202nd%20Floor%20Front%202024.jpg,$550/mo,,"<p id="""">Windows on the world! Peaceful while invigorating space suitable for 1 to 3 traditional office stations. Including central HVAC, and freshly carpeted and painted.</p>",,false,no
(#229) Windows On The World,229-windows-on-the-world,66feff006098b94b602774a2,66feff006098b94b602774a1,6706c4523384b9a1c8912f4a,false,true,Wed Oct 09 2024 17:58:42 GMT+0000 (Coordinated Universal Time),Mon Aug 11 2025 15:12:50 GMT+0000 (Coordinated Universal Time),,https://cdn.prod.website-files.com/66feff006098b94b602774a0/6706c4303186b50f5885b963_2021-Fall-2nd-floor-windows-5-__FocusFillWzE2ODAsOTQ1LCJ5IiwxNTdd.jpg,https://cdn.prod.website-files.com/66feff006098b94b602774a0/6706c4303186b50f5885b963_2021-Fall-2nd-floor-windows-5-__FocusFillWzE2ODAsOTQ1LCJ5IiwxNTdd.jpg,https://cdn.prod.website-files.com/66feff006098b94b602774a0/6706c43878685e3ba247d627_2021-Fall-2nd-Floor-Windows-2-3__FitMaxWzIwMDAsMjAwMF0.jpg; https://cdn.prod.website-files.com/66feff006098b94b602774a0/6706c438206104ca57c6f0ec_2021-Fall-2nd-Floor-windows-4__FitMaxWzIwMDAsMjAwMF0.jpg; https://cdn.prod.website-files.com/66feff006098b94b602774a0/6706c438af94d4ff92866ae8_2021-Fall-2nd-floor-windows-5-__FitMaxWzIwMDAsMjAwMF0.jpg,LEASED,,"<p>Second floor office with three LARGE windows! Suits one to four standard work stations. Come join our Lansdale Business Center Community, comprised of dynamic and exciting individuals and businesses, focused on growing and enhancing their products; sharing their passion for their work!</p>",,false,
(#300) Main Dock-Shop/Studio,300-main-dock-shop-studio,66feff006098b94b602774a2,66feff006098b94b602774a1,66feff006098b94b6027752d,false,true,Fri Jul 19 2024 05:38:37 GMT+0000 (Coordinated Universal Time),Mon Aug 11 2025 15:10:40 GMT+0000 (Coordinated Universal Time),,https://cdn.prod.website-files.com/66feff006098b94b602774a0/6705907d121e7d499d5be902_Shop-300-8-2022__FocusFillWzE2ODAsOTQ1LCJ5IiwxNThd.jpg,https://cdn.prod.website-files.com/66feff006098b94b602774a0/6705907d121e7d499d5be902_Shop-300-8-2022__FocusFillWzE2ODAsOTQ1LCJ5IiwxNThd.jpg,https://cdn.prod.website-files.com/66feff006098b94b602774a0/6705915dd5deae9731aad84a_Shop-300-5-2022__FitMaxWzIwMDAsMjAwMF0.jpg; https://cdn.prod.website-files.com/66feff006098b94b602774a0/6705915d7e2f7c6b93040015_Shop-300-8-2022__FitMaxWzIwMDAsMjAwMF0.jpg; https://cdn.prod.website-files.com/66feff006098b94b602774a0/6705915d3a9877a0a3dbfbe0_Shop-300-10-2022__FitMaxWzIwMDAsMjAwMF0.jpg,$875/mo,515 sq ft,<p>True Flex Space with ALL of the Amenities AND The Right Size!</p>,,true,yes
(#314) Private Shop/Studio/Offices,314-private-shop-studio-offices,66feff006098b94b602774a2,66feff006098b94b602774a1,66feff006098b94b602774d4,false,true,Fri Jul 19 2024 05:38:37 GMT+0000 (Coordinated Universal Time),Mon Aug 11 2025 15:10:27 GMT+0000 (Coordinated Universal Time),,https://cdn.prod.website-files.com/66feff006098b94b602774a0/6706aeda22c1438b48c7f47f_2022-SG-6__FocusFillWzE2ODAsOTQ1LCJ5IiwxNThd%20(1).jpg,https://cdn.prod.website-files.com/66feff006098b94b602774a0/6706aeda22c1438b48c7f47f_2022-SG-6__FocusFillWzE2ODAsOTQ1LCJ5IiwxNThd%20(1).jpg,https://cdn.prod.website-files.com/66feff006098b94b602774a0/6706af2cc61b54735d1a04b1_2022-SG-8-__FitMaxWzIwMDAsMjAwMF0.jpg; https://cdn.prod.website-files.com/66feff006098b94b602774a0/6706af2d90f84bca4fead5a1_2022-SG-6__FitMaxWzIwMDAsMjAwMF0.jpg; https://cdn.prod.website-files.com/66feff006098b94b602774a0/6706af2c916d1356999c4317_2022-SG-4__FitMaxWzIwMDAsMjAwMF0.jpg; https://cdn.prod.website-files.com/66feff006098b94b602774a0/6706af2c6581ec94f7c6709b_xsx.jpg; https://cdn.prod.website-files.com/66feff006098b94b602774a0/6706af2c8688bb5855819ea3_Shop-toward-Office-2020__FitMaxWzIwMDAsMjAwMF0.jpg; https://cdn.prod.website-files.com/66feff006098b94b602774a0/6706af2d12088542f0b412b0_2022-SG-3__FitMaxWzIwMDAsMjAwMF0.jpg,"$1,625/mo","1,350 sq ft","<p id="""">AWESOME! Clean and Fresh - Multi-Area - Multi-Function Flex Space!</p><p>‍</p><p id="""">""Shop Area"", currently used as office, features painted Concrete flooring with man door access to other areas in the overall space. Double Doors to Common Corridor to Main Loading Dock. Ground Level Shipping and Receiving outside of door. Shop Ceiling Height 9' and 3p Electric Service</p><p>‍</p><p id="""">Access is 24/7 Work when you need to!</p><p>‍</p><p id="""">There are many unique and useful features to consider in this space and the photos will help, but best to come take a Look and SEE all of the possibilities!</p><p>‍</p><p id="""">Rents are inclusive of our Front Desk Support Services! We sit and sign for deliveries and will keep you connected via text and/or email - You let us know!</p><p id="""">‍</p>",,false,
(CF3) Upper Dock Studio/Shop/Office Space,cf3-upper-dock-studio-shop-office-space,66feff006098b94b602774a2,66feff006098b94b602774a1,6706b829448fcf39f8788be2,false,true,Wed Oct 09 2024 17:06:49 GMT+0000 (Coordinated Universal Time),Mon Aug 11 2025 15:11:38 GMT+0000 (Coordinated Universal Time),,https://cdn.prod.website-files.com/66feff006098b94b602774a0/6706b7aec46cad0fa29cc053_CF3-The-Birds-__FocusFillWzE2ODAsOTQ1LCJ5IiwxNThd.jpg,https://cdn.prod.website-files.com/66feff006098b94b602774a0/6706b7aec46cad0fa29cc053_CF3-The-Birds-__FocusFillWzE2ODAsOTQ1LCJ5IiwxNThd.jpg,https://cdn.prod.website-files.com/66feff006098b94b602774a0/6706b7ce92fdfec9e8d5b46e_CF3-Office-4-__FitMaxWzIwMDAsMjAwMF0.jpg; https://cdn.prod.website-files.com/66feff006098b94b602774a0/6706b7cdd6fe3c5bff8dc2e3_CF3-Front-Back-1-__FitMaxWzIwMDAsMjAwMF0.jpg; https://cdn.prod.website-files.com/66feff006098b94b602774a0/6706b7ce120d999abf34eead_CF3-Dock-Down__FitMaxWzIwMDAsMjAwMF0.jpg; https://cdn.prod.website-files.com/66feff006098b94b602774a0/6706b7ce33a329815ddcea2f_CF3-COmmon-Dock-__FitMaxWzIwMDAsMjAwMF0.jpg,LEASED,,"<p>Your Upper Dock Studio/Shop/Office Space! Features 14' Ceilings and <em id="""">NEW LED Lighting</em>. Perfectly suited to design, production and distribution.</p>",,false,
